[
  {
    "id": "war",
    "char": "sprite_equip_iron_sword",
    "name": "War",
    "setSize": 3,
    "role": "offense",
    "desc": "+5% ATK per mark",
    "setDesc": "Set: +20% more ATK",
    "onEquip": [
      {
        "stat": "atk",
        "op": "mul",
        "value": 1.05
      }
    ],
    "onSet": [
      {
        "stat": "atk",
        "op": "mul",
        "value": 1.20
      }
    ]
  },
  {
    "id": "cryo",
    "char": "special_ice",
    "name": "Cryo",
    "setSize": 3,
    "role": "utility",
    "desc": "+2% tick slow per mark",
    "setDesc": "Set: +20% more tick slow, and a 25% chance to freeze an enemy you hit",
    "onEquip": [
      {
        "stat": "tickSlowPercent",
        "value": 2
      }
    ],
    "onSet": [
      {
        "stat": "tickSlowPercent",
        "value": 20
      },
      {
        "stat": "stunAttackChance",
        "value": 0.25
      }
    ]
  },
  {
    "id": "sick",
    "char": "status_poison",
    "name": "Sick",
    "setSize": 3,
    "role": "offense",
    "desc": "+5% chance to poison on hit",
    "setDesc": "Set: 100% poison on hit",
    "onEquip": [
      {
        "stat": "poisonAttackChance",
        "value": 0.05,
        "max": 1.0
      }
    ],
    "onSet": [
      {
        "stat": "poisonAttackChance",
        "op": "set",
        "value": 1.0
      }
    ]
  },
  {
    "id": "sight",
    "char": "fx_arcane",
    "name": "Sight",
    "setSize": 2,
    "role": "utility",
    "desc": "+1 vision radius per mark",
    "setDesc": "Set: +3 more vision radius",
    "onEquip": [
      {
        "stat": "visionRadius",
        "value": 1
      }
    ],
    "onSet": [
      {
        "stat": "visionRadius",
        "value": 3
      }
    ]
  },
  {
    "id": "speed",
    "char": "trap_smoke",
    "name": "Speed",
    "setSize": 2,
    "role": "utility",
    "desc": "Collecting the set grants extra move",
    "setDesc": "Set: move twice per turn",
    "onEquip": [],
    "onSet": [
      {
        "stat": "bonusHeroMoves",
        "value": 1
      }
    ]
  },
  {
    "id": "life",
    "char": "item_heart",
    "name": "Life",
    "setSize": 3,
    "role": "defense",
    "desc": "+6% Max HP per mark",
    "setDesc": "Set: free revive (erases all marks!)",
    "onEquip": [
      {
        "stat": "maxHp",
        "op": "mul",
        "value": 1.06
      },
      {
        "stat": "hp",
        "op": "mul",
        "value": 1.06
      }
    ],
    "onSet": [
      {
        "stat": "lifeBrandRevive",
        "op": "set",
        "value": true
      }
    ]
  },
  {
    "id": "guard",
    "char": "sprite_equip_buckler",
    "name": "Guard",
    "setSize": 2,
    "role": "defense",
    "desc": "+3% Max HP damage reduction per mark (max 65%)",
    "setDesc": "Set: +8% more damage reduction",
    "onEquip": [
      {
        "stat": "damageReduction",
        "value": 0.03,
        "max": 0.65
      }
    ],
    "onSet": [
      {
        "stat": "damageReduction",
        "value": 0.08,
        "max": 0.65
      }
    ]
  },
  {
    "id": "leech",
    "char": "sprite_blood",
    "name": "Leech",
    "setSize": 2,
    "role": "defense",
    "desc": "+3% Max HP heal on kill per mark (max 60%)",
    "setDesc": "Set: +12% more HP on kill",
    "onEquip": [
      {
        "stat": "killHeal",
        "value": 0.03,
        "max": 0.6
      }
    ],
    "onSet": [
      {
        "stat": "killHeal",
        "value": 0.12,
        "max": 0.6
      }
    ]
  },
  {
    "id": "forge",
    "char": "fx_fire",
    "name": "Forge",
    "setSize": 3,
    "role": "offense",
    "desc": "+4% ATK line-clear damage per mark (max 200%)",
    "setDesc": "Set: +25% more line-clear damage",
    "onEquip": [
      {
        "stat": "lineClearDamage",
        "value": 0.04,
        "max": 2.0
      }
    ],
    "onSet": [
      {
        "stat": "lineClearDamage",
        "value": 0.25,
        "max": 2.0
      }
    ]
  },
  {
    "id": "ghost",
    "char": "sprite_boss_wraith",
    "name": "Ghost",
    "setSize": 2,
    "role": "defense",
    "desc": "+3% dodge chance per mark",
    "setDesc": "Set: +15% more dodge, and a guaranteed dodge once per floor",
    "onEquip": [
      {
        "stat": "dodgeChance",
        "value": 0.03,
        "max": 0.75
      }
    ],
    "onSet": [
      {
        "stat": "dodgeChance",
        "value": 0.15,
        "max": 0.75
      },
      {
        "stat": "ghostDodgeCharges",
        "value": 1
      }
    ]
  }
]
